{
  "svl_version": "5.0",
  "algorithm": {
    "name": "Dijkstra's Algorithm",
    "family": "Graph Shortest Path"
  },
  "initial_frame": {
    "styles": {
      "elementStyles": {
        "idle": {
          "fill": "#E8F5E9",
          "stroke": "#424242",
          "strokeWidth": 1.5
        },
        "compare": {
          "fill": "#F8BBD0",
          "stroke": "#FFB300",
          "strokeWidth": 2
        },
        "sorted": {
          "fill": "#C8E6C9",
          "stroke": "#2196F3",
          "strokeWidth": 1.5
        },
        "swapping": {
          "fill": "#F48FB1",
          "stroke": "#D32F2F",
          "strokeWidth": 2.5
        },
        "pivot": {
          "fill": "#FFF9C4",
          "stroke": "#00897B",
          "strokeWidth": 2.5
        },
        "key_element": {
          "fill": "#A5D6A7",
          "stroke": "#009688",
          "strokeWidth": 2.5
        },
        "placeholder": {
          "fill": "#F5F5F5",
          "stroke": "#BDBDBD"
        },
        "shifting": {
          "fill": "#B2DFDB",
          "stroke": "#1976D2"
        },
        "sub_array_active": {
          "fill": "#FCE4EC",
          "stroke": "#AFB42B",
          "strokeWidth": 1.5
        },
        "partition_area": {
          "fill": "#E8F5E9",
          "stroke": "#66BB6A",
          "strokeWidth": 1.5
        },
        "heap_area": {
          "fill": "#F5F5F5",
          "stroke": "#616161"
        },
        "idle_node": {
          "fill": "#FAFAFA",
          "stroke": "#616161",
          "strokeWidth": 2
        },
        "current_node": {
          "fill": "#FFF9C4",
          "stroke": "#FBC02D",
          "strokeWidth": 3
        },
        "visited_node": {
          "fill": "#E8EAF6",
          "stroke": "#3F51B5",
          "strokeWidth": 2
        },
        "in_path_node": {
          "fill": "#C8E6C9",
          "stroke": "#4CAF50",
          "strokeWidth": 2.5
        },
        "normal_edge": {
          "color": "#9E9E9E",
          "strokeWidth": 1.5
        },
        "traversed_edge": {
          "color": "#7E57C2",
          "strokeWidth": 3
        },
        "in_path_edge": {
          "color": "#66BB6A",
          "strokeWidth": 3.5
        },
        "current_cell": {
          "fill": "rgba(255, 249, 196, 0.7)"
        },
        "dependency_cell": {
          "fill": "rgba(225, 245, 254, 0.7)"
        },
        "updated_cell": {
          "fill": "rgba(200, 230, 201, 0.7)"
        }
      },
      "variableStyles": {
        "default_pointer": {
          "color": "#D32F2F",
          "shape": "arrow"
        },
        "default_value": {
          "color": "#212121"
        }
      },
      "tempStyles": {
        "swap_arrow": {
          "color": "#D32F2F",
          "strokeWidth": 2,
          "tip": "Stealth"
        },
        "dependency_arrow": {
          "color": "#FF7043",
          "strokeWidth": 1.5,
          "tip": "Latex"
        },
        "partition_box": {
          "fill": "rgba(179, 229, 252, 0.2)",
          "stroke": "#0288D1",
          "strokeDash": "4 2"
        },
        "key_holder_box": {
          "fill": "#F3E5F5",
          "stroke": "#8E24AA"
        },
        "parent_child_link": {
          "color": "#009688",
          "strokeWidth": 1.5,
          "tip": "none"
        },
        "heap_boundary": {
          "fill": "rgba(200, 230, 201, 0.2)",
          "stroke": "#4CAF50",
          "strokeDash": "4 2"
        }
      },
      "commentStyles": {
        "default_comment": {
          "fill": "#EEEEEE",
          "fontColor": "#212121",
          "borderColor": "#BDBDBD"
        }
      },
      "animationStyles": {
        "default_move": {
          "type": "ease-in-out",
          "duration": 500
        }
      }
    },
    "pseudocode": [
      "function Dijkstra(graph, start):",
      "  dist = init_distances_to_infinity()",
      "  dist[start] = 0",
      "  pq = new PriorityQueue()",
      "  pq.add((0, start))",
      "  while pq is not empty:",
      "    dist_u, u = pq.pop()",
      "    if dist_u > dist[u]: continue",
      "    for each neighbor v of u:",
      "      weight_uv = weight(u, v)",
      "      if dist[u] + weight_uv < dist[v]:",
      "        dist[v] = dist[u] + weight_uv",
      "        predecessor[v] = u",
      "        pq.add((dist[v], v))",
      "  return dist, predecessor"
    ],
    "variables_schema": [
      {
        "name": "currentNode",
        "type": "value"
      },
      {
        "name": "priorityQueue",
        "type": "list"
      }
    ],
    "data_schema": {
      "node_properties_schema": [
        {
          "name": "dist",
          "type": "value"
        },
        {
          "name": "pred",
          "type": "value"
        }
      ]
    },
    "data_state": {
      "type": "graph",
      "structure": {
        "nodes": [
          {
            "id": "A",
            "styleKey": "idle_node",
            "properties": {
              "dist": "∞",
              "pred": "-"
            }
          },
          {
            "id": "B",
            "styleKey": "idle_node",
            "properties": {
              "dist": "∞",
              "pred": "-"
            }
          },
          {
            "id": "C",
            "styleKey": "idle_node",
            "properties": {
              "dist": "∞",
              "pred": "-"
            }
          },
          {
            "id": "D",
            "styleKey": "idle_node",
            "properties": {
              "dist": "∞",
              "pred": "-"
            }
          },
          {
            "id": "E",
            "styleKey": "idle_node",
            "properties": {
              "dist": "∞",
              "pred": "-"
            }
          }
        ],
        "edges": [
          {
            "from": "A",
            "to": "B",
            "directed": false,
            "label": "11",
            "styleKey": "normal_edge",
            "properties": {
              "weight": 11
            }
          },
          {
            "from": "A",
            "to": "C",
            "directed": false,
            "label": "11",
            "styleKey": "normal_edge",
            "properties": {
              "weight": 11
            }
          },
          {
            "from": "A",
            "to": "D",
            "directed": false,
            "label": "15",
            "styleKey": "normal_edge",
            "properties": {
              "weight": 15
            }
          },
          {
            "from": "D",
            "to": "E",
            "directed": false,
            "label": "18",
            "styleKey": "normal_edge",
            "properties": {
              "weight": 18
            }
          }
        ]
      }
    },
    "code_highlight": 1
  },
  "deltas": [
    {
      "meta": {},
      "code_highlight": 3,
      "operations": [
        {
          "op": "updateNodeProperties",
          "params": {
            "updates": [
              {
                "id": "C",
                "properties": {
                  "dist": 0
                }
              }
            ]
          }
        }
      ]
    },
    {
      "meta": {
        "priorityQueue": [
          [
            0,
            "C"
          ]
        ]
      },
      "code_highlight": 4,
      "operations": [
        {
          "op": "updateNodeStyle",
          "params": {
            "ids": [
              "C"
            ],
            "styleKey": "queued_node"
          }
        }
      ]
    },
    {
      "meta": {
        "priorityQueue": [
          [
            0,
            "C"
          ]
        ]
      },
      "code_highlight": 6,
      "operations": []
    },
    {
      "meta": {
        "priorityQueue": [],
        "currentNode": "C"
      },
      "code_highlight": 7,
      "operations": [
        {
          "op": "updateNodeStyle",
          "params": {
            "ids": [
              "C"
            ],
            "styleKey": "current_node"
          }
        }
      ]
    },
    {
      "meta": {
        "priorityQueue": [],
        "currentNode": "C"
      },
      "code_highlight": 11,
      "operations": [
        {
          "op": "updateNodeStyle",
          "params": {
            "ids": [
              "A"
            ],
            "styleKey": "compare"
          }
        },
        {
          "op": "updateEdgeStyle",
          "params": {
            "edges": [
              {
                "from": "C",
                "to": "A"
              }
            ],
            "styleKey": "traversed_edge"
          }
        }
      ]
    },
    {
      "meta": {
        "priorityQueue": [
          [
            11,
            "A"
          ]
        ],
        "currentNode": "C"
      },
      "code_highlight": 13,
      "operations": [
        {
          "op": "updateNodeProperties",
          "params": {
            "updates": [
              {
                "id": "A",
                "properties": {
                  "dist": 11,
                  "pred": "C"
                }
              }
            ]
          }
        }
      ]
    },
    {
      "meta": {
        "priorityQueue": [
          [
            11,
            "A"
          ]
        ],
        "currentNode": "C"
      },
      "code_highlight": 14,
      "operations": [
        {
          "op": "updateEdgeStyle",
          "params": {
            "edges": [
              {
                "from": "C",
                "to": "A"
              }
            ],
            "styleKey": "relaxed_edge"
          }
        },
        {
          "op": "updateNodeStyle",
          "params": {
            "ids": [
              "A"
            ],
            "styleKey": "queued_node"
          }
        }
      ]
    },
    {
      "meta": {
        "priorityQueue": [
          [
            11,
            "A"
          ]
        ],
        "currentNode": "C"
      },
      "code_highlight": 11,